{
  "assets": [],
  "cameraTracks": [
    {
      "easing": "ease-in-out",
      "id": "arc",
      "interpolation": "cubic",
      "keyframes": [
        {
          "at": 0,
          "pose": {
            "position": [0, 0, 0],
            "rotation": [0, 0, 0],
            "zoom": 1.3
          }
        },
        {
          "at": 0.5,
          "pose": {
            "position": [450, -350, 200],
            "rotation": [10, 35, -25],
            "zoom": 0.75
          }
        },
        {
          "at": 1,
          "pose": {
            "position": [1050, -50, -100],
            "rotation": [5, 10, -5],
            "zoom": 1.1
          }
        }
      ]
    }
  ],
  "cues": [
    {
      "atMs": 0,
      "edgeId": "AB",
      "event": "presentation.entry",
      "id": "entry",
      "payload": {
        "branch": "B"
      }
    },
    {
      "atMs": 600,
      "edgeId": "AB",
      "event": "presentation.mark",
      "id": "midpoint",
      "payload": {
        "label": "metà percorso"
      }
    },
    {
      "atMs": 1200,
      "edgeId": "AB",
      "event": "presentation.arrival",
      "id": "arrival",
      "payload": null
    }
  ],
  "defaultPathId": "branch",
  "extensions": {},
  "id": "structure-branching",
  "metadata": {
    "language": "it",
    "title": "Rami, gerarchia e camera"
  },
  "paths": [
    {
      "edges": [
        {
          "cameraTrackId": "arc",
          "condition": {
            "kind": "manual"
          },
          "from": "A",
          "id": "AB",
          "label": "Esplora B",
          "to": "B",
          "transition": {
            "durationMs": 1200,
            "easing": "ease-in-out"
          }
        },
        {
          "condition": {
            "kind": "manual"
          },
          "from": "A",
          "id": "AC",
          "label": "Esplora C",
          "to": "C",
          "transition": {
            "durationMs": 1200,
            "easing": "ease-in-out"
          }
        },
        {
          "condition": {
            "kind": "manual"
          },
          "from": "B",
          "id": "BD",
          "label": "Conclusione da B",
          "to": "D",
          "transition": {
            "durationMs": 1200,
            "easing": "ease-in-out"
          }
        },
        {
          "condition": {
            "kind": "manual"
          },
          "from": "C",
          "id": "CD",
          "label": "Conclusione da C",
          "to": "D",
          "transition": {
            "durationMs": 1200,
            "easing": "ease-in-out"
          }
        },
        {
          "condition": {
            "kind": "manual"
          },
          "from": "D",
          "id": "DA",
          "label": "Ripeti (massimo 2 visite)",
          "to": "A",
          "transition": {
            "durationMs": 1200,
            "easing": "ease-in-out"
          }
        },
        {
          "condition": {
            "kind": "manual"
          },
          "from": "D",
          "id": "DD",
          "label": "Sosta (massimo 2 visite)",
          "to": "D",
          "transition": {
            "durationMs": 1200,
            "easing": "ease-in-out"
          }
        }
      ],
      "id": "branch",
      "loopPolicy": {
        "maxVisitsPerNode": 2
      },
      "name": "Biforcazione e loop",
      "nodes": [
        {
          "holdMs": 0,
          "id": "A",
          "sceneId": "A"
        },
        {
          "holdMs": 0,
          "id": "B",
          "sceneId": "B"
        },
        {
          "holdMs": 0,
          "id": "C",
          "sceneId": "C"
        },
        {
          "holdMs": 0,
          "id": "D",
          "sceneId": "D"
        }
      ],
      "startNodeId": "A"
    },
    {
      "edges": [
        {
          "from": "alt-C",
          "id": "alt-CD",
          "label": "Vai alla conclusione",
          "to": "alt-D",
          "transition": {
            "durationMs": 600,
            "easing": "linear"
          }
        }
      ],
      "id": "alternate",
      "name": "Percorso alternativo",
      "nodes": [
        {
          "holdMs": 0,
          "id": "alt-C",
          "sceneId": "C"
        },
        {
          "holdMs": 0,
          "id": "alt-D",
          "sceneId": "D"
        }
      ],
      "startNodeId": "alt-C"
    },
    {
      "edges": [
        {
          "from": "7e06a378-d740-4e65-989a-b476cd5785e0",
          "id": "630e1e58-88de-459d-b967-5e7517b1d7c5",
          "label": "",
          "to": "d995e766-44e9-49c8-85e7-c877d69010c8",
          "transition": {
            "durationMs": 600,
            "easing": "ease-in-out"
          }
        },
        {
          "from": "d995e766-44e9-49c8-85e7-c877d69010c8",
          "id": "5d4c0e66-c4f7-461f-b4a2-9bf5c7294a8d",
          "label": "",
          "to": "347daa4a-0642-41ac-b538-678d3c9875f9",
          "transition": {
            "durationMs": 600,
            "easing": "ease-in-out"
          }
        },
        {
          "condition": {
            "kind": "manual"
          },
          "from": "7e06a378-d740-4e65-989a-b476cd5785e0",
          "id": "36b17749-212e-412a-8520-c843a6aaed01",
          "label": "Scelta diretta D",
          "to": "347daa4a-0642-41ac-b538-678d3c9875f9",
          "transition": {
            "durationMs": 600,
            "easing": "ease-in-out"
          }
        }
      ],
      "id": "08fe0d6b-ec5a-4381-a1b9-d0f272284115",
      "name": "Lettura da Studio",
      "nodes": [
        {
          "holdMs": 0,
          "id": "7e06a378-d740-4e65-989a-b476cd5785e0",
          "sceneId": "A"
        },
        {
          "holdMs": 0,
          "id": "d995e766-44e9-49c8-85e7-c877d69010c8",
          "sceneId": "C"
        },
        {
          "holdMs": 0,
          "id": "347daa4a-0642-41ac-b538-678d3c9875f9",
          "sceneId": "D"
        }
      ],
      "startNodeId": "7e06a378-d740-4e65-989a-b476cd5785e0"
    }
  ],
  "requiredCapabilities": ["linear", "structure"],
  "scenes": [
    {
      "blocks": [
        {
          "data": {
            "text": "Scegli un approfondimento: B oppure C."
          },
          "id": "text-A",
          "type": "text"
        }
      ],
      "extensions": {},
      "id": "A",
      "notes": "Nota A",
      "parentId": null,
      "position": [0, 0, 0],
      "rotation": [0, 0, 0],
      "scale": 1,
      "size": [700, 400],
      "title": "A · Inizio",
      "visible": true
    },
    {
      "blocks": [
        {
          "data": {
            "text": "Un secondo percorso raggiunge la stessa conclusione."
          },
          "id": "text-C",
          "type": "text"
        }
      ],
      "extensions": {},
      "id": "C",
      "notes": "Nota C",
      "parentId": null,
      "position": [-1300, 200, -100],
      "rotation": [5, -10, -12],
      "scale": 1,
      "size": [700, 400],
      "title": "C · Alternativa",
      "visible": true
    },
    {
      "blocks": [
        {
          "data": {
            "text": "Il ramo B entra in una scena figlia ruotata."
          },
          "id": "text-B",
          "type": "text"
        }
      ],
      "extensions": {},
      "id": "B",
      "notes": "Nota B",
      "parentId": "A",
      "position": [1000, -80, -150],
      "rotation": [12, 20, -18],
      "scale": 0.7,
      "size": [700, 400],
      "title": "B · Figlia",
      "visible": true
    },
    {
      "blocks": [
        {
          "data": {
            "text": "Torna alla visita effettiva o ripeti il loop limitato."
          },
          "id": "text-D",
          "type": "text"
        }
      ],
      "extensions": {},
      "id": "D",
      "notes": "Nota D",
      "parentId": null,
      "position": [1500, 850, -300],
      "rotation": [-8, 10, 12],
      "scale": 1,
      "size": [700, 400],
      "title": "D · Conclusione",
      "visible": true
    }
  ],
  "schemaVersion": "1.1.0",
  "settings": {
    "presentation": {
      "defaultTransition": {
        "durationMs": 600,
        "easing": "ease-in-out"
      },
      "fit": "contain",
      "motion": "system"
    },
    "viewport": {
      "height": 720,
      "perspective": 1000,
      "width": 1280
    }
  }
}
