{
  "assets": [],
  "cameraTracks": [],
  "cues": [],
  "defaultPathId": "3a408174-995b-4ed1-8542-e0e582368a51",
  "extensions": {},
  "id": "68c7f432-8bef-4d82-adfe-af31406bffb5",
  "metadata": {
    "language": "it",
    "title": "Senza titolo"
  },
  "paths": [
    {
      "edges": [
        {
          "from": "1af9d6ca-dc88-47c9-be9b-b41dc9a4048f",
          "id": "d163c6c5-6c62-4be3-b5ca-de8b3fd8fdd3",
          "label": "",
          "to": "82c4af2b-1daf-42ef-8eed-7fb8583b5f54",
          "transition": {
            "durationMs": 600,
            "easing": "ease-in-out"
          }
        },
        {
          "from": "82c4af2b-1daf-42ef-8eed-7fb8583b5f54",
          "id": "3c253449-8be2-497d-ae1d-a99d05695770",
          "label": "",
          "to": "02595351-5a59-433b-8acf-c4b55c0fb7a8",
          "transition": {
            "durationMs": 600,
            "easing": "ease-in-out"
          }
        }
      ],
      "id": "3a408174-995b-4ed1-8542-e0e582368a51",
      "name": "Principale",
      "nodes": [
        {
          "holdMs": 0,
          "id": "1af9d6ca-dc88-47c9-be9b-b41dc9a4048f",
          "sceneId": "3340db55-309a-496a-b53a-216a6f6ac59a"
        },
        {
          "holdMs": 0,
          "id": "82c4af2b-1daf-42ef-8eed-7fb8583b5f54",
          "sceneId": "e2613a17-ae19-4861-974a-50aaffd1d841"
        },
        {
          "holdMs": 0,
          "id": "02595351-5a59-433b-8acf-c4b55c0fb7a8",
          "sceneId": "5f05b400-82e7-4f0e-a6eb-3f9de07c6a26"
        }
      ],
      "startNodeId": "1af9d6ca-dc88-47c9-be9b-b41dc9a4048f"
    }
  ],
  "requiredCapabilities": ["linear"],
  "scenes": [
    {
      "blocks": [
        {
          "data": {
            "text": "Scrivi la tua idea."
          },
          "id": "240ce585-6e9a-4eab-b57f-b226a6f58a3b",
          "type": "text"
        }
      ],
      "extensions": {},
      "id": "3340db55-309a-496a-b53a-216a6f6ac59a",
      "notes": "",
      "parentId": null,
      "position": [0, 0, 0],
      "rotation": [0, 0, 0],
      "scale": 1,
      "size": [800, 450],
      "title": "Idea 1",
      "visible": true
    },
    {
      "blocks": [
        {
          "data": {
            "text": "Una forma di pensiero nello spazio <script>letterale</script>"
          },
          "id": "e2e60126-6078-435b-8dc9-8eb0f943f268",
          "type": "text"
        }
      ],
      "extensions": {},
      "id": "e2613a17-ae19-4861-974a-50aaffd1d841",
      "notes": "Nota privata, conservata nel documento.",
      "parentId": null,
      "position": [555, -120, 175],
      "rotation": [12, 23, 34],
      "scale": 1.4,
      "size": [880, 500],
      "title": "Idea 2",
      "visible": true
    },
    {
      "blocks": [
        {
          "data": {
            "text": "Scrivi la tua idea."
          },
          "id": "3eb21d43-10b3-4854-bb33-e0318f70b55e",
          "type": "text"
        }
      ],
      "extensions": {},
      "id": "5f05b400-82e7-4f0e-a6eb-3f9de07c6a26",
      "notes": "",
      "parentId": null,
      "position": [2000, 0, 0],
      "rotation": [0, 0, 0],
      "scale": 1,
      "size": [800, 450],
      "title": "Idea 3",
      "visible": true
    }
  ],
  "schemaVersion": "1.1.0",
  "settings": {
    "presentation": {
      "defaultTransition": {
        "durationMs": 600,
        "easing": "ease-in-out"
      },
      "fit": "contain",
      "motion": "system"
    },
    "viewport": {
      "height": 720,
      "perspective": 1000,
      "width": 1280
    }
  }
}
